{
  "schema_version": "expect-canary-result/1.0",
  "result_id": "CAN-IMP-20260719-miss-001-2026-07-21T13-18-09Z",
  "proposal_id": "IMP-20260719-miss-001",
  "run_id": "2026-07-21T13-18-09Z",
  "verdict": null,
  "evaluation_status": "pending_human_review",
  "gates": {},
  "warnings": [],
  "metrics": {},
  "rollback_triggered": false,
  "refs": {
    "proposal_path": "development/proposals/IMP-20260719-miss-001.json",
    "config_path": "development/canary/configs/IMP-20260719-miss-001.json",
    "criteria_path": "development/canary/criteria/IMP-20260719-miss-001.json",
    "evidence_sample": [],
    "canary_result_path": "development/canary/results/IMP-20260719-miss-001/latest.json"
  },
  "lifecycle_applied": null,
  "evaluated_at": null,
  "notes": [
    "Canary skipped until development/reviews/IMP-20260719-miss-001.json status=approved"
  ],
  "metadata": {
    "event_types": [
      "miss"
    ],
    "confidence_policy": "canary_verdict_from_gates_not_analyzer_confidence"
  }
}
